{
  "$schema": "https://json-schema.org/draft/2020-12/schema",
  "$id": "urn:world-studio:proposal:world_studio.physical_asset.v0.1",
  "title": "World Studio Physical Asset v0.1",
  "description": "Design proposal only. Records geometry and experiment-scoped physical-parameter evidence. Passive capture is C0 evidence and cannot establish mass, inertia, friction, restitution, stiffness, damping, force, torque, or general physics authority.",
  "type": "object",
  "additionalProperties": false,
  "required": [
    "schema",
    "asset_id",
    "version",
    "world_id",
    "object_id",
    "created_at",
    "lifecycle_status",
    "calibration_tier",
    "coordinate_frame",
    "geometry",
    "materials",
    "articulation",
    "parameters",
    "authority",
    "provenance"
  ],
  "properties": {
    "schema": {
      "const": "world_studio.physical_asset.v0.1"
    },
    "asset_id": {
      "$ref": "#/$defs/identifier"
    },
    "version": {
      "type": "integer",
      "minimum": 1,
      "maximum": 2147483647
    },
    "parent_version": {
      "oneOf": [
        {
          "type": "null"
        },
        {
          "type": "integer",
          "minimum": 1,
          "maximum": 2147483647
        }
      ]
    },
    "world_id": {
      "$ref": "#/$defs/identifier"
    },
    "object_id": {
      "$ref": "#/$defs/identifier"
    },
    "created_at": {
      "$ref": "#/$defs/timestamp"
    },
    "lifecycle_status": {
      "enum": [
        "draft",
        "proposal",
        "validated",
        "promoted",
        "held",
        "rejected"
      ]
    },
    "calibration_tier": {
      "enum": [
        "C0",
        "C1",
        "C2",
        "C3",
        "C4",
        "C5"
      ]
    },
    "coordinate_frame": {
      "type": "object",
      "additionalProperties": false,
      "required": [
        "frame_id",
        "handedness",
        "up_axis",
        "length_unit"
      ],
      "properties": {
        "frame_id": {
          "$ref": "#/$defs/identifier"
        },
        "handedness": {
          "enum": [
            "right",
            "left"
          ]
        },
        "up_axis": {
          "enum": [
            "+X",
            "-X",
            "+Y",
            "-Y",
            "+Z",
            "-Z"
          ]
        },
        "length_unit": {
          "const": "m"
        }
      }
    },
    "geometry": {
      "type": "object",
      "additionalProperties": false,
      "required": [
        "visual",
        "metric",
        "collision",
        "geometry_status"
      ],
      "properties": {
        "visual": {
          "oneOf": [
            {
              "type": "null"
            },
            {
              "$ref": "#/$defs/artifactReference"
            }
          ]
        },
        "metric": {
          "oneOf": [
            {
              "type": "null"
            },
            {
              "$ref": "#/$defs/artifactReference"
            }
          ]
        },
        "collision": {
          "oneOf": [
            {
              "type": "null"
            },
            {
              "$ref": "#/$defs/artifactReference"
            }
          ]
        },
        "geometry_status": {
          "enum": [
            "capture_proposal",
            "scaled",
            "metric_validated",
            "collision_validated",
            "held",
            "rejected"
          ]
        }
      }
    },
    "materials": {
      "type": "array",
      "maxItems": 256,
      "items": {
        "type": "object",
        "additionalProperties": false,
        "required": [
          "material_id",
          "label",
          "source_class",
          "status"
        ],
        "properties": {
          "material_id": {
            "$ref": "#/$defs/identifier"
          },
          "label": {
            "type": "string",
            "minLength": 1,
            "maxLength": 256
          },
          "source_class": {
            "enum": [
              "observed",
              "catalog",
              "user_declared",
              "estimated"
            ]
          },
          "status": {
            "enum": [
              "proposal",
              "validated",
              "held",
              "rejected"
            ]
          }
        }
      }
    },
    "articulation": {
      "type": "array",
      "maxItems": 1024,
      "items": {
        "type": "object",
        "additionalProperties": false,
        "required": [
          "joint_id",
          "parent_link",
          "child_link",
          "joint_type",
          "axis",
          "status"
        ],
        "properties": {
          "joint_id": {
            "$ref": "#/$defs/identifier"
          },
          "parent_link": {
            "$ref": "#/$defs/identifier"
          },
          "child_link": {
            "$ref": "#/$defs/identifier"
          },
          "joint_type": {
            "enum": [
              "fixed",
              "revolute",
              "prismatic",
              "continuous"
            ]
          },
          "axis": {
            "$ref": "#/$defs/vector3"
          },
          "status": {
            "enum": [
              "proposal",
              "validated",
              "held",
              "rejected"
            ]
          }
        }
      }
    },
    "parameters": {
      "type": "array",
      "maxItems": 4096,
      "items": {
        "$ref": "#/$defs/physicalParameter"
      }
    },
    "authority": {
      "$ref": "#/$defs/authority"
    },
    "provenance": {
      "$ref": "#/$defs/assetProvenance"
    }
  },
  "$defs": {
    "identifier": {
      "type": "string",
      "pattern": "^[A-Za-z0-9][A-Za-z0-9._-]{0,127}$"
    },
    "timestamp": {
      "type": "string",
      "pattern": "^\\d{4}-\\d{2}-\\d{2}T\\d{2}:\\d{2}:\\d{2}(?:\\.\\d+)?Z$"
    },
    "finiteNumber": {
      "type": "number",
      "minimum": -1000000000000,
      "maximum": 1000000000000
    },
    "nonNegativeFinite": {
      "type": "number",
      "minimum": 0,
      "maximum": 1000000000000
    },
    "positiveFinite": {
      "type": "number",
      "exclusiveMinimum": 0,
      "maximum": 1000000000000
    },
    "fraction": {
      "type": "number",
      "minimum": 0,
      "maximum": 1
    },
    "vector3": {
      "type": "array",
      "minItems": 3,
      "maxItems": 3,
      "items": {
        "$ref": "#/$defs/finiteNumber"
      }
    },
    "sha256": {
      "type": "string",
      "pattern": "^sha256:[0-9a-f]{64}$"
    },
    "safeRelativePath": {
      "type": "string",
      "minLength": 1,
      "maxLength": 1024,
      "pattern": "^[^\\u0000]+$",
      "not": {
        "anyOf": [
          {
            "pattern": "^/"
          },
          {
            "pattern": "\\\\"
          },
          {
            "pattern": "//|/$"
          },
          {
            "pattern": "^[A-Za-z][A-Za-z0-9+.-]*:"
          },
          {
            "pattern": "(^|/)\\.\\.?(/|$)"
          }
        ]
      }
    },
    "artifactReference": {
      "type": "object",
      "additionalProperties": false,
      "required": [
        "path",
        "sha256",
        "size_bytes",
        "media_type"
      ],
      "properties": {
        "path": {
          "$ref": "#/$defs/safeRelativePath"
        },
        "sha256": {
          "$ref": "#/$defs/sha256"
        },
        "size_bytes": {
          "type": "integer",
          "minimum": 0,
          "maximum": 9007199254740991
        },
        "media_type": {
          "type": "string",
          "pattern": "^[a-z0-9][a-z0-9!#$&^_.+-]*/[a-z0-9][a-z0-9!#$&^_.+-]*$"
        }
      }
    },
    "parameterRange": {
      "type": "object",
      "additionalProperties": false,
      "required": [
        "minimum",
        "maximum"
      ],
      "properties": {
        "minimum": {
          "type": "array",
          "minItems": 1,
          "maxItems": 16,
          "items": {
            "$ref": "#/$defs/finiteNumber"
          }
        },
        "maximum": {
          "type": "array",
          "minItems": 1,
          "maxItems": 16,
          "items": {
            "$ref": "#/$defs/finiteNumber"
          }
        }
      }
    },
    "parameterUncertainty": {
      "type": "object",
      "additionalProperties": false,
      "required": [
        "model",
        "absolute",
        "confidence_level"
      ],
      "properties": {
        "model": {
          "enum": [
            "bounded",
            "standard_deviation",
            "confidence_interval",
            "unknown"
          ]
        },
        "absolute": {
          "type": "array",
          "minItems": 1,
          "maxItems": 16,
          "items": {
            "$ref": "#/$defs/nonNegativeFinite"
          }
        },
        "confidence_level": {
          "oneOf": [
            {
              "type": "null"
            },
            {
              "$ref": "#/$defs/fraction"
            }
          ]
        }
      }
    },
    "solverProvenance": {
      "type": "object",
      "additionalProperties": false,
      "required": [
        "experiment_ids",
        "solver"
      ],
      "properties": {
        "experiment_ids": {
          "type": "array",
          "minItems": 1,
          "maxItems": 4096,
          "uniqueItems": true,
          "items": {
            "$ref": "#/$defs/identifier"
          }
        },
        "solver": {
          "type": "object",
          "additionalProperties": false,
          "required": [
            "name",
            "version",
            "configuration_sha256"
          ],
          "properties": {
            "name": {
              "$ref": "#/$defs/identifier"
            },
            "version": {
              "type": "string",
              "minLength": 1,
              "maxLength": 128
            },
            "configuration_sha256": {
              "$ref": "#/$defs/sha256"
            }
          }
        }
      }
    },
    "parameterScope": {
      "type": "object",
      "additionalProperties": false,
      "required": [
        "simulator",
        "simulator_version",
        "contact_model",
        "material_pair",
        "task_envelope"
      ],
      "properties": {
        "simulator": {
          "type": "string",
          "minLength": 1,
          "maxLength": 128
        },
        "simulator_version": {
          "type": "string",
          "minLength": 1,
          "maxLength": 128
        },
        "contact_model": {
          "type": "string",
          "minLength": 1,
          "maxLength": 128
        },
        "material_pair": {
          "oneOf": [
            {
              "type": "null"
            },
            {
              "type": "object",
              "additionalProperties": false,
              "required": [
                "asset_material_id",
                "counterpart_material_id"
              ],
              "properties": {
                "asset_material_id": {
                  "$ref": "#/$defs/identifier"
                },
                "counterpart_material_id": {
                  "$ref": "#/$defs/identifier"
                }
              }
            }
          ]
        },
        "task_envelope": {
          "type": "string",
          "minLength": 1,
          "maxLength": 512
        }
      }
    },
    "physicalParameter": {
      "type": "object",
      "additionalProperties": false,
      "required": [
        "parameter_id",
        "kind",
        "joint_id",
        "component_names",
        "value",
        "unit",
        "valid_range",
        "uncertainty",
        "source_class",
        "identifiability",
        "provenance",
        "scope",
        "authority_status",
        "approved_for",
        "not_approved_for"
      ],
      "properties": {
        "parameter_id": {
          "$ref": "#/$defs/identifier"
        },
        "kind": {
          "enum": [
            "dimensions",
            "mass",
            "center_of_mass",
            "inertia_tensor",
            "static_friction",
            "dynamic_friction",
            "restitution",
            "stiffness",
            "damping",
            "rolling_resistance",
            "joint_lower_limit",
            "joint_upper_limit",
            "joint_stiffness",
            "joint_damping"
          ]
        },
        "joint_id": {
          "oneOf": [
            {
              "type": "null"
            },
            {
              "$ref": "#/$defs/identifier"
            }
          ]
        },
        "component_names": {
          "type": "array",
          "minItems": 1,
          "maxItems": 16,
          "items": {
            "$ref": "#/$defs/identifier"
          }
        },
        "value": {
          "type": "array",
          "minItems": 1,
          "maxItems": 16,
          "items": {
            "$ref": "#/$defs/finiteNumber"
          }
        },
        "unit": {
          "enum": [
            "m",
            "kg",
            "kg*m^2",
            "dimensionless",
            "N/m",
            "N*s/m",
            "rad",
            "N*m/rad",
            "N*m*s/rad"
          ]
        },
        "valid_range": {
          "$ref": "#/$defs/parameterRange"
        },
        "uncertainty": {
          "$ref": "#/$defs/parameterUncertainty"
        },
        "source_class": {
          "enum": [
            "measured_direct",
            "measured_indirect",
            "catalog",
            "estimated",
            "simulator_default"
          ]
        },
        "identifiability": {
          "enum": [
            "unobserved",
            "weak",
            "identified",
            "held"
          ]
        },
        "provenance": {
          "$ref": "#/$defs/solverProvenance"
        },
        "scope": {
          "$ref": "#/$defs/parameterScope"
        },
        "authority_status": {
          "enum": [
            "proposal",
            "validated",
            "promoted",
            "held",
            "rejected"
          ]
        },
        "approved_for": {
          "type": "array",
          "maxItems": 128,
          "uniqueItems": true,
          "items": {
            "$ref": "#/$defs/identifier"
          }
        },
        "not_approved_for": {
          "type": "array",
          "minItems": 1,
          "maxItems": 128,
          "uniqueItems": true,
          "items": {
            "$ref": "#/$defs/identifier"
          }
        }
      }
    },
    "authority": {
      "type": "object",
      "additionalProperties": false,
      "required": [
        "classification",
        "approved_for",
        "not_approved_for",
        "limitations"
      ],
      "properties": {
        "classification": {
          "enum": [
            "geometry_proposal",
            "experiment_conditioned_proposal",
            "task_scoped_validated_physics",
            "external_validation_required"
          ]
        },
        "approved_for": {
          "type": "array",
          "maxItems": 128,
          "uniqueItems": true,
          "items": {
            "$ref": "#/$defs/identifier"
          }
        },
        "not_approved_for": {
          "type": "array",
          "minItems": 1,
          "maxItems": 128,
          "uniqueItems": true,
          "items": {
            "$ref": "#/$defs/identifier"
          }
        },
        "limitations": {
          "type": "array",
          "minItems": 1,
          "maxItems": 128,
          "items": {
            "type": "string",
            "minLength": 1,
            "maxLength": 1024
          }
        }
      }
    },
    "assetProvenance": {
      "type": "object",
      "additionalProperties": false,
      "required": [
        "producer",
        "producer_version",
        "created_at",
        "input_artifacts",
        "experiment_ids",
        "run_id"
      ],
      "properties": {
        "producer": {
          "$ref": "#/$defs/identifier"
        },
        "producer_version": {
          "type": "string",
          "minLength": 1,
          "maxLength": 128
        },
        "created_at": {
          "$ref": "#/$defs/timestamp"
        },
        "input_artifacts": {
          "type": "array",
          "maxItems": 65536,
          "items": {
            "$ref": "#/$defs/artifactReference"
          }
        },
        "experiment_ids": {
          "type": "array",
          "maxItems": 4096,
          "uniqueItems": true,
          "items": {
            "$ref": "#/$defs/identifier"
          }
        },
        "run_id": {
          "$ref": "#/$defs/identifier"
        }
      }
    }
  }
}
